<?xml version="1.0" encoding="UTF-8"?> 

<team xmlns:xsi="http://www.w3.org/2001/XMLSchema-instance" xsi:noNamespaceSchemaLocation="team.xsd"> 
   <id>3418</id> 
   <name>نادي شبيبة القبائل</name> 
   <image>https://s1.hesport.com/themes/desktop/img/teams/3418.png</image> 
   <country>الجزائر</country> 
   <adrese>Stade du 1er Novembre 1954</adrese> 
   <website>http://www.jeunessesportivedekabylie.com/</website> 
   <creation-date>1946</creation-date> 
   <players> 
     <player id="49108" /> 
     <player id="49132" /> 
     <player id="312110" /> 
     <player id="455173" /> 
     <player id="501758" /> 
     <player id="621073" /> 
     <player id="645414" /> 
     <player id="647539" /> 
     <player id="89335" /> 
     <player id="178609" /> 
     <player id="263487" /> 
     <player id="264054" /> 
     <player id="266643" /> 
     <player id="322708" /> 
     <player id="360357" /> 
     <player id="414108" /> 
     <player id="421933" /> 
     <player id="431452" /> 
     <player id="455156" /> 
     <player id="470672" /> 
     <player id="470673" /> 
     <player id="495326" /> 
     <player id="495328" /> 
     <player id="495331" /> 
     <player id="555720" /> 
     <player id="555721" /> 
     <player id="555728" /> 
     <player id="555729" /> 
     <player id="585112" /> 
     <player id="630110" /> 
     <player id="64553" /> 
     <player id="103095" /> 
     <player id="103793" /> 
     <player id="164027" /> 
     <player id="191276" /> 
     <player id="245203" /> 
     <player id="256487" /> 
     <player id="265340" /> 
     <player id="331272" /> 
     <player id="358633" /> 
     <player id="432211" /> 
     <player id="438593" /> 
     <player id="443874" /> 
     <player id="467528" /> 
     <player id="479151" /> 
     <player id="495306" /> 
     <player id="495333" /> 
     <player id="495334" /> 
     <player id="496055" /> 
     <player id="501761" /> 
     <player id="556756" /> 
     <player id="585111" /> 
     <player id="621078" /> 
     <player id="647176" /> 
     <player id="648336" /> 
     <player id="183199" /> 
     <player id="192679" /> 
     <player id="262302" /> 
     <player id="281753" /> 
     <player id="309951" /> 
     <player id="359729" /> 
     <player id="401717" /> 
     <player id="428973" /> 
     <player id="430650" /> 
     <player id="431448" /> 
     <player id="468256" /> 
     <player id="470294" /> 
     <player id="513309" /> 
     <player id="555727" /> 
     <player id="585110" /> 
     <player id="604968" /> 
   </players> 
   <coaches> 
     <coach id="49022" /> 
     <coach id="111200" /> 
     <coach id="138182" /> 
     <coach id="210744" /> 
     <coach id="304814" /> 
     <coach id="393661" /> 
     <coach id="403968" /> 
     <coach id="434798" /> 
     <coach id="440747" /> 
     <coach id="467109" /> 
     <coach id="541967" /> 
     <coach id="593876" /> 
   </coaches> 
</team>